Pesan,Klasifikasi
"stroke merupakan penyakit saraf yang paling sering mengakibatkan cacat dan kematian. disamping menduduki peringkat utama diantara segolongan penyakit saraf yang mengakibatkan kematian, stroke juga merupakan salah satu dari tiga penyebab utama kematian pada umumnya. dari berbagai fakta tersebut menunjukkan bahwa sampai saat ini, stroke masih merupakan masalah utama di bidang neurologi maupun kesehatan pada umumnya. untik mengatasi masalah krusial ini, diperlukan strategi penanggulangan stroke yang menbcakup aspek preventif, terapi rahabilitasi, dan promotif. sebenarnya kasus stroke sudah terjadi sejak dahulu, hal ini dibuktikan dengan adanya pertolongan pertama pada kasus stroke berdasarkan pengobatan tradisional cina dengan teknik akupunktur, namun teknik ini pernah terlupakan, sehingga dampak yang ditimbulkan menjadi semakin besar. sebagaimana diketahui, orang yang mendapat serangan stroke, seluruh darah di tubuh akan mengalir sangat kencang menuju pembuluh darah di otak. apabila kegiatan pertolongan diberikan terlambatsedikit saja, maka pembuluh darah pada otak tidak akan kuat menahan aliran darah yang mengalir dengan deras dan akan segera pecah sedikit demi sedikit. pertolongan pertama pada stroke dengan cara mengeluarkan darah pada setiap ujung jari tangan dan ujung daun telinga. ada satu cara terbaik untuk memberikan pertolongan pertama kepada orang yang mendapat serangan stroke. cara ini selain dapat menyelamatkan nyawa sih penderita, juga tidak menimbulkan efek sampingan apapun. pertolongan pertama ini dijamin merupakan pertolongan gawat darurat yang dapat berhasil 100. dalam menghadapi keadaan ini keluarga jangan sampai panik, tetapi harus tenang. sipenderita harus tetap berada ditempat semula dimana ia terjatuh mis dikamar mandi, kamar tidur, atau dimana saja. jangan dipindahkan ! sebab dengan memindahkan sih penderita dari tempat semula akan mempercepat perpecahan pembuluh darah halus di otak. penderita harus dibantu mengambil posisi duduk yang baik agar tidak terjatuh lagi, dan pada saat itu pengeluaran darah dapat dilakukan. untuk yang terbaik menggunakan jarum suntik, namun apabila tidak ada, maka jarum jahit jarum pentul peniti dapat dipakai dengan terlebih dahulu disterilkan dulu dengan cara dibakar diatas api. segera setelah jarum steril, lakukan penusukan pada 10 ujung jari tangan. titik penusukan kira-kira imm dari ujung kuku. setiap jari cukup ditusuk 1 kali saja dengan harapan setiap jari mengeluarkan 1 tetes darah. pengeluaran darah juga dapat dibantu dengan cara dipencet apabila darah ternyata tidak keluar dari ujung jari. dalam jangka waktu kira-kira 10 menit, sih penderita akan segera sadar kembali. bila mulut sipenderita tampak mencong tidak normal, maka kedua daun telinga sipenderita harus ditarik-tarik sampai berwarna kemerah-merahan. setelah itu lakukanlah 2 kali penusukan pada masing-masing ujung bawah daun telinga sehingga darah keluar sebanyak 2 tetes dari setiap ujung daun telinga. dengan demikian dalam beberapa menit bentuk mulut sipenderita akan kembali normal. setelah keadaan sipenderita pulih dan tidak ada kelainan yang berarti, maka bawalah sipenderita dengan hati-hati ke dokter atau rumah sakit terdekat untuk mendapatkan pertolongan lebih lanjut.",SALAH
"menurut salah seorang professor asal cina, anda harus senantiasa memiliki dan menyimpan sebuah jarum di dalam rumah. karena dapat dimanfaatkan untuk mengatasi orang yang terkena stroke. ketika seseorang mengalami stroke, pembuluh rambut otaknya secara perlahan akan tersobek. maka dari itu, pertolongan pertama sangat dibutuhkan. berikut ini langkah-langkah yang harus anda lakukan, seperti dilansir dari lifehealthandfood.com tetap tenang. bagaimana pun posisi pasien, anda tidak boleh memindahkan atau menggerakannya. karena jika tidak, anda akan menyebabkan kapileri otaknya akan meledak dan terjadi pendarahan di dalam otak. menggunakan suntik akan lebih baik, namun sebagai alternative bisa memanfaakan jarum jahit. panaskan jarum tersebut dengan lilin atau korek api untuk mensterilkannya. dengan jarum itu, tusuk kesepuluh ujung jari pasien dengannya. tidak dibutuhkan ahli dalam akupuntur. namun pastikan, jika tusukan anda beberpa millimeter agak jauh dari kuku. lakukan hal tersebut hingga darah keluar dari jari-jarinya jika darah tidak keluar, diremas atau dipijat hingga keluar darah. ketika darah telah mengalir dari kesepuluh jarinya, tunggu beberapa menit, insya allah, pasien akan siuman dan sadar. jika anda perhatikan mulut pasien berubah, mulailah pijat kedua telinganya hingga darah mengalir ke situ dan terlihat telinganya menjadi merah. tusuk pada bagian lembut di telinga dengan menggunakan jarum, hingga dua tetes darah jatuh dari masing-masin telinganya. setelah beberapa menit, insya allah mulutnya tidak akan lagi berubah. ketika anda pastikan tidak ada lagi gejala-gejala aneh pada diri pasien dan sudah kembali normal, bawalah ke rumah sakit.",SALAH
"serangan stroke bisa terjadi pada siapa saja dan kapan saja. stroke terjadi lantaran adanya penyumbatan atau pecahnya pembuluh darah di otak. selama ini beredar kabar yang menyarankan kita agar menusuk ujung jari penderita stroke untuk mengatasi penyumbatan dan membuat peredaran darah menjadi lebih lancar. benarkah hal tersebut? menurut rocksy f.v. situmeang, dokter spesialis saraf, siloam hospitals lippo karawaci, cara tersebut adalah keliru. menusuk jari pasien stroke dengan jarum bahkan harus dihindari. menusukkan jarum pada jari pasien stroke hanya akan menimbulkan nyeri, dan dapat meningkatkan tekanan darah. hal tersebut justru dapat membahayakan nyawa. apabila ada keluarga atau kerabat yang terserang stroke, sebaiknya anda segera membawanya ke rumah sakit untuk mendapatkan penanganan yang tepat, ucap rocksy. itu merupakan satu-satunya cara untuk menghadapi stroke. empat jam pertama setelah serangan stroke terjadi merupakan masa yang sangat menentukan dalam penanganan stroke selanjutnya. semakin cepat pasien stroke dibawa ke rumah sakit, semakin besar kemungkinan mereka untuk diselamatkan. kecepatan membawa pasien stroke ke rumah sakit juga dapat menurunkan risiko terjadinya kecacatan pascastroke. beberapa gejala serangan stroke yang patut anda waspadai adalah kelemahan pada salah satu sisi anggota gerak, kesulitan bicara atau mengerti pembicaraan, bicara pelo, gangguan pada penglihatan, hingga nyeri kepala yang hebat secara mendadak.",BENAR
"akhir-akhir ini kita sering mendapat broadcast informasi via bbm tentang cara pertolongan pertama pada penderita stroke, bunyi pesan broadcast tersebut kira-kira sebagai berikut orang yang kena stroke mendadak jatuh dari wc dsb, pembuluh darah ke otak akan pecah sedikit demi sedikit. ingat, untuk mengatasi hal ini janganlah gugup panik. jika korban berada di tempat kejadian seperti dikamar mandi ruang tidur ruang tamu dll. jangan dipindah2kan ke tempat lain, karena akan percepat pecahnya pembuluh darah, dan janganlah sampai penderita terjatuh lagi. cara pertolongan pertama pada penderita stroke adalah dengan mengeluarkan darah korban dengan menggunakan jarum yang telah dibakardisteril yang kemudian ditusukkan ke ujung setiap jari masih sampai darahnya keluar 1-2 tetes. kalau darahnya tidak keluar dapat diurut sampai keluar, sesudah itu korban akan sadar setelah beberapa menit kemudian. jika korban mulutnya miring, tariklah kedua daun telinganya sampai merah dan langsung tusuk bagian bawah daun telinga dengan jarum steril sampai darah keluar 1-2 tetes. setelah korban sadar dan mulutnya sudah pulih kembali, barulah dibawa ke dokter rumah sakit. biasanya orang yang terkena stroke pembuluh darahnya akan lebih cepat pecah karena goncangan dalam perjalanan ke rumah sakit dokter. orang tersebut dapat tidak sadar kembali pingsan dan biasanya akan cacat lumpuh. ingat ya, cara pertolongan pertama pada penderita stroke adalah dengan cara mengeluarkan darah dari jari orang yang terkena stroke, maka kita sudah bisa menolong orang tersebut dari penyakit stroke yang menimpanya. untuk mendapatkan informasi yang akurat demi kepentingan bersama, cuitnews melakukan penelusuran dan mencari berbagai referensi tentang benar atau tidaknya broadcast diatas. berikut ini hasil rangkuman informasi yang cuitnews dapatkan dari berbagai sumber dr. ahmad yanuar, sps menepis kebenarannya. sejauh ini tidak ada penelitian seperti itu, tidak diketahui efektif atau tidaknya tindakan tersebut, kata dokter saraf dari universitas indonesia tersebut kepada detikhealth. hal ini juga diperkuat oleh dr. fritz sumantri, sps. yang harus digarisbawahi adalah kedokteran berangkat dari penelitian dan uji coba. adapun cara di luar itu belum ada penelitiannya. setidaknya keamanannya belum terjamin. sampai saat ini ilmu kedokteran tidak mengenal cara seperti itu, sehingga kita juga tidak tahu efektivitasnya, tegasnya. satu-satunya tindakan yang harus segera dilakukan adalah dengan membawa ke rumahs sakit dan diberikan tindakan reperfusi pada jam-jam tercepat. sekitar 3 - 6 jam setelah kejadian, pasien harus segera dilarikan ke rumah sakit untuk mendapatkan tindakan medis, tambah dari ahmad. pasien harus segera mendapatkan pemeriksaan lengkap mengenai kondisinya. sehingga, tusuk jarum pada jari atau pun tusuk dibagian bawah telinga bukanlah cara yang tepat sebab tidak akan menghilangkan penyumbatan atau perdarahan yang terjadi di otak pasien. hal serupa pun ditegaskan oleh dari fritz sumantri, sps. ia berkata bahwa pasien harus langsung dibawake rumah sakit bukan ditusuk jarum atau hanya membawa ke klinik. tidak benar jika pasien tidak boleh dipindahkan ke mana-mana, justru harus segera dibawa ke rumah sakit. bahaya dari cara tusuk jarum tersebut memang tidak ada, hanya saja jika pasien cepat dibawa ke rumah sakit kemungkinan sembuhnya juga akan cepat dan tidak terlambat penanganannya, katanya. di situ dikatakan bahwa hal ini akan meredakan tekanan darah dan menghilangkan gejala. saran ini tidak memiliki dasar ilmiah, bahkan berbahaya. memaksa korban stroke untuk duduk bukan sebuah ide yang baik karena akan mengakibatkan penurunan tekanan darah. sebaiknya biarkan korban tetap berbaring. menusuk jari korban juga ide buruk, bukan hanya karena sia-sia, tetapi juga karena hanya akan membuang waktu. semakin cepat menghubungi petugas medis semakin baik, pasien stroke harus secepatnya dirawat dengan tepat, setiap menit akan sangat berharga. hanya perawatan medis gawat darurat yang dapat membantu korban stroke, dan hasil usaha para tenaga ahli hanya akan optimal apabila mereka menolong paling lambat 3 jam setelah serangan. semoga rangkuman informasi tentang cara pertolongan pertama pada penderita stroke yang sering kita dapatkan via broadcast message ini bisa kita pahami bersama dan dapat kita ambil kesimpulan sendiri mana yang benar dan salah. jangan salah dalam mengambil kesimpulan dan tindakan, karena ini sangat berbahaya bagi penderita stroke dan bahkan bisa jadi tidak tertolong.",SALAH
"jakarta, ada perilaku di masyarakat yang menusuk jarum atau menyilet sedikit kulit pada orang yang terkena stroke hingga keluar darahnya. konon tujuannya untuk memperlancar aliran darah yang tersumbat akibat stroke. bagian yang ditusuk jarum supaya darah keluar itu dilakukan di semua ujung jari atau di telinga. kemudian ada juga tindakan menarik-narik telinga jika melihat pasien serangan stroke yang mulutnya mencong. sayangnya, tindakan itu sama sekali belum ada buktinya bahkan cenderung melukai sih penderita. tidak ada bukti empiris perlakukan menusuk jarum atau menarik-narik kuping sebagai pertolongan pertama untuk serangan stroke. banyak sekali hal-hal di masyarakat yang salah kaprah mengenai berbagai macam cara yang dilakukan saat darurat, misalnya menusuk dengan jarum. sebetulnya cara ini tidak terbukti secara empiris bisa menyembuhkan fase awal stroke, ujar dari manfaluthy hakim, spsk dari departemen neurologi fkui saat dihubungi detikhealth, rabu 472012. dari luthy menuturkan cara yang paling tepat dalam penanganan stroke adalah segera bawa ke rumah sakit, ini karena keberhasilan stroke sangat dipengaruhi oleh waktu. dari luthy biasa menyebut golden period untuk stroke adalah 3 jam setelah serangan awal. jika ditolong dalam waktu golden period ini maka kemungkinan untuk pulihnya lebih besar dibanding orang yang terlambat ditolong, ujar dokter yang lahir di jakarta 49 tahun silam. jika mengalami atau melihat gejala seperti ini tiba-tiba mengalami kelumpuhan di salah satu sisi tubuh, bicara pelo, kesemutan di sebelah bagian tubuh atau tidak sadarkan diri sebaiknya langsung di bawa ke rumah sakit untuk ditangani dan diobati. jangan ditunda tunda lagi atau mencoba menolong mengobati sendiri, karena seberapa cepat pasien itu mendapatkan pertolongan yang benar maka kerusakan di otak akibat stroke bisa diminimalisir. masyarakat kadang ada yang mengenal istilah stroke ringan jika gejala yang muncul tidak terlalu parah atau hanya sedikit tanda dan gejala yang muncul. tapi masyarakat sebaiknya tidak menganggap remeh kondisi ini. kalau di kita enggak ada istilah stroke ringan, sedang atau berat, semuanya sama yaitu stroke dan penanganannya sama. karena kalau dibilang stroke ringan dan tidak ada penanganan maka bisa menjadi kondisi yang berat, ungkapnya. misalnya saja penyumbatan di otaknya hanya sedikit tapi jika tidak langsung segera dibawa ke rumah sakit maka bisa menjadi berat, kondisi lainnya seperti pembuluh darah yang pecah sudah meluas bisa membuat pasien tidak tertolong. dari luthy mengungkapkan berdasarkan data dari riskesdas tahun 2007 diketahui bahwa pada usia 55-64 tahun baik masyarakat yang berada di kota maupun desa, stroke merupakan penyebab utama kematian.",BENAR
"ada beberapa mitos mengenai pencegahan penyakit stroke. salah satunya adalah menusukkan jarum. dari frandy susatia sps mengatakan bahwa mitos tersebut merupakan hal yang justru bisa membahayakan diri sendiri. apalagi, jika yang melakukannya juga menderita diabetes. tidak benar kalau untuk mencegah stroke dengan menusukkan jarum. itu cuma mitos, katanya di jakarta, baru-baru ini. selain menusukkan jarum, mitos lainnya adalah mengguyur kulit saat kepanasan. namun lagi-lagi, dokter yang praktek di rs siloam kebon jeruk itu menyangkalnya. tidak benar. kalau kepanasan, pembuluh darahnya akan menyebar, tapi akan normal lagi ketika panas itu berkurang. hanya pingsan, tapi tidak stroke, karena pembuluh darahnya sedang uploading, tutupnya.",SALAH
"garuda news orang yang terkena serangan stroke yang secara mendadak dan tidak melihat tempat dan kondisi dimana jatuh seperti dari wc tempat kerja maupun di kamar tidur, biasanya orang yang mengalami terkena serangan stroke secara mendadak itu semua pembuluh darah ke otak perlahan akan pecah bertahap sedikit demi sedikit. dan perlu anda ingat dan ketahui bahwa untuk mengatasi saat terkena serangan stroke secara mendadak dan hal pertama yang anda lakukan ini janganlah gugup panik. jika korban berada di tempat kejadian seperti dikamar mandi ruang tidur ruang tamu dll. ingat jangan dipindah-pindahkan ke tempat korban jatuh ke tempat yang lain, karena hal ini dapat memperburuk keadaan sih penderita stroke yang menyebabkan terjadinya akan mempercepat pecahnya pembuluh darah di seluruh otak, dan janganlah sampai sih penderita stroke ini terjatuh untuk kedua kalinya. untuk pertolongan pertama saat terkena serangan stroke yang tepat yang harus anda lakukan adalah dengan cara dengan mengeluarkan darah korban dengan menggunakan jarum yang telah dibakar dengan syarat kondisi jarum tersebut sudah steril yang kemudian ditusukkan ke setiap ujung jari jempol kedua nya masing-masing sampai darahnya keluar 1-2 tetes. kalau darahnya tidak keluar dapat dilakukan cara dengan diurut sampai keluar, sesudah itu korban akan sadar setelah beberapa menit kemudian. jika korban mulutnya miring, tariklah kedua daun telingany sampai merah dan langsung tusuk bagian bawah daun telinga dengan jarum steril sampai darah keluar 1-2 tetes. setelah korban sadar dan mulutnya sudah pulih kembali, barulah dibawa ke dokter rumah sakit. biasanya orang yang terkena stroke pembuluh darahnya akan lebih cepat pecah karena goncangan dalam perjalanan ke rumah sakit atau dokter. orang tersebut dapat tidak sadar kembali pingsan dan biasanya akan mengalami cacat atau lumpuh. kita harus ingat mengeluarkan dari jari orang yang terkena stroke, maka kita sudah bisa menolong orang tersebut dari penyakit stroke",SALAH
"saat salah satu anggota keluaraga terserang stroke, biasanya anggota keluarga lain berinsiatif memberi pertolongan pertama. misalnya, dengan menusuk ujung-ujung jemari penderita dengan jarum untuk mengecek apa ia sudah mati rasa atau belum. lalu, membuat rapat keluarga dadakan membahas sih penderita stroke mau dibawa ke rumah sakit mana dan ke dokter siapa. inisiatif tersebut, kata prof. dr. dr. mohammad hasan machfoed, sp.sk, masih tidak penting! hal tersebut terungkap dalam talk show grand kalbe academia yang mengusung tema indonesian neurologist forum di jakarta, sabtu 42 kemarin. mohammad hasan mengatakan, begitu salah satu anggota keluarga kena stroke, harus segera dibawa ke dokter spesialis. jangan kebanyakan berpikir, mengadakan rapat keluarga, menelepon saudara yang dituakan, bla-bla-bla. itu malah memperburuk keadaan. stoke tidak bisa ditolong oleh anggota keluarga sendiri. begini, ketika seseorang kena stroke, otak tiba-tiba kekurangan oksigen dan dalam waktu 10 menit dapat merusak seluruh otak. setelah 10 menit itu, ia mengalami area panombra yakni antara hidup dan mati. saat itulah, kita harus memberi pertolongan secara tepat dan hanya dokter spesialis yang bisa melakukannya. salah memberi pertolongan bisa mengakibatkan nekrosis atau kematian sel pada seluruh jaringan tubuh, ujar mohammad hassan kepada tabloidbintang.com. stroke menyerang pada waktu yang tidak terduga. ia membawa perubahan yang sifatnya progresif. cepat sekali. perubahan yang sangat cepat itu, kata mohammad hassan, disebabkan oleh otak yang tiba-tiba kekurangan oksigen. karena kekurangan oksigen, otak membengkak. jika tidak cepat ditangani pembengkakan itu menyebabkan penderita meninggal dunia. proses menuju kematian akan menjadi sangat cepat jika ia jatuh atau mengalami sumbatan di saluran napas. yang penting, anggota keluarga mesti cermat mendeteksi gejala-gejala yang ganjil sejak dini. misalnya, bangun tidur bicaranya pelo. atau tiba-tiba mengalami lumpuh sebelah. atau kondisi kejiwaanya berubah, mudah lupa, beri tahu mohammad hassan. hal lain yang patut diperhatikan keluarga adalah pada pukul berapa sih penderita kena stroke. misalnya, jam 6 pagi. anda harus gerak cepat membawanya ke dokter dalam waktu kurang dari empat jam setelah jam 6 pagi. mohammad hassan menegaskan, empat jam setelah serangan stroke terjadi adalah waktu yang paling krusial. ia harus mendapat pertolongan yang tepat dan cepat. jika anda di jakarta, anda bisa membawa pasien ke rumah sakit cipto mangunkusumo, misalnya. di sana, memungkinkan pasien menjalani trombolisis proses penghancuran gumpalan darah-red yang memungkinkan penderita stroke pulih. syaratnya, harus mendapat pertolongan kurang dari empat jam, lanjutnya. mohammad hassan menilai kesadaran masyarakat indonesia terhadap bahaya stroke sudah membaik. namun, harus terus ditingkatkan mengingat stroke masih menjadi penyakit paling mematikan di negara ini. karenanya, ketua perhimpunan dokter spesialis saraf indonesia itu menyambut baik penyelenggaraan grand kalbe academia 2017. direktur pt kalbe farma michael buyung nugroho menambahkan, indonesian neurologist forum berbicara tentang neurological disorder. gangguan neurologis bisa berujung disabilitas hingga kematian. kami ingin berkontribusi lebih dalam membangun kompetensi untuk para dokter neurologi baik yang senior maupun junior agar makin memahami neurological disorder. mengingat penyakit ini berdampak pada penurunan produktivitas pasien dan kualitas hidup keluarga pasien.",BENAR
"dari catatan yayasan indonesia penyakit stroke adalah penyakit berbahaya ketiga yang banyak menyumbangkan kematian dengan kecenderungan terus meningkat.apa yang akan anda lakukan jika di sekitar anda ada seseorang dengan tiba-tiba terkena penyakit stroke? tentu saja, anda harus bisa berpikir dengan jernih dan tenang agar bisa memberi pertolongan pertama pada sih penderita. berikut ini kami akan memberi tahu bagai mana caranya memberi pertolongan pertama pada penyakit stroke jangan dipindahkan,jika anda memindahkan penderita dari tempat asal tempat semula itu akan membuat kemungkinan pecahnya pembuluh darah halus dalam otak akan semakin cepat terjadi dan tentunya ini akan beresiko. cukup bantu penderita mengambil posisi untuk duduk supaya tidak terjatuh lagi tusuk ujung ujung jari dengan jarum, dianjurkan menggunakan jarum suntik. tetapi jika tidak ada maka anda bisa menggunakan jarum lain yang tidak terlalu besar ex jarum jahit, jarum pentul dan tentunya harus dalam kondisi steril dengan cara dibakar. titik yang harus ditusuk adalah sekitar 1 mm dari ujung kuku. usahakan agar setidaknya darah bisa menetes sedikit 1 tetes cukup. jika tidak bisa, tekan jari jari tersebut. dalam jangka waktu sekitar 10 menit, penderita akan sadar kembali. tarik tarik dan tusuk daun telinga. apabila mulut penderita terlihat kurang normal, anda mungkin harus mencoba menarik menarik kedua telinga penderita tersebut hingga terlihat agak kemerahan. kemudian, lakukan 2 kali tusukan pada ujung bawah telinga dengan jarum kecil yang sudah disterilkan sehingga darah menetes 2 kali dari dari masing masing daun telinga. dalam beberapa menit mulut penderita akan kembali normal. cari pertolongan medis, saat kondisi penderita mulai pulih kembali, segeralah cari pertolongan medis. bawalah penderita ke dokter terdekat atau rumah sakit terdekat untuk mendapatkan tindakan yang lebih lanjut. ingat, sebelum 6 jam sejak dihitung sejak serangan, penderita stroke sudah harus mendapat pertolongan medis. sekian beberapa informasi dan tips tentang pertolongan pertama pada penderita stroke, semoga anda dapat memberikan pertolongan pada orang disekitar anda dan membantu menyelamatkan satu nyawa manusia. semoga artikel ini bermanfaat bagi kita semua",SALAH
"iphone 6 plus dikeluhkan sejumlah pengguna memiliki kelemahan mudah melengkung bila terlalu lama disimpan di saku celana. apple dinilai melakukan kesalahan besar dengan memilih material campuran metal-aluminium alloy yang tidak terlalu solid sebagai bahan dasar rangka iphone 6 plus. atas kelemahannya itu, smartphone anyar apple berlayar jumbo 5,5 inci itu kini dilaporkan menjadi bahan olok-olokan di berbagai media sosial. sejumlah kompetitor apple pun tak menyia-nyiakan kesempatan ini untuk menghajar apple. menurut yang dilansir laman business insider, kamis 2592014, hashtag , atau yang bisa ditafsirkan sebagai skandal melengkung iphone 6 plus menjadi topik hangat di sejumlah media sosial. banyak pengguna twitter, path, serta jejaring sosial berbagai foto lainnya yang mengejek kelemahan iphone 6 plus itu. contohnya seperti yang dilakukan oleh akun twitter resmi brand makanan ringan . brand yang memang menjalin kerjasama dengan google ini mem-posting sebuah foto yang menyindir betapa ringkihnya rangka handset iphone 6. mereka juga berkicau, kami tidak melengkung, kami . .",BENAR
"iphone 6 plus melengkung jadi bahan ejekan di dunia maya. kasus melengkungnya iphone 6 plus setelah digunakan beberapa waktu oleh pengguna, belakangan ini semakin populer. setelah sebuah channel youtube unbox therapy melakukan pengujian, bodi iphone 6 plus memang tidak terlalu kuat dan bisa mengalami lengkungan yang cukup signifikan. tak pelak, hal ini menjadi gunjingan di media sosial. tak lupa juga para kompetitor yang turut mengejek kekurangan iphone 6 yang terbilang fatal ini. di twitter, topik dengan hashtag masih cukup menjadi perbincangan. hashtag yang bisa diartkan sebagai skandal melengkung tersebut merupakan bentuk sindiran terhadap kelemahan apple iphone 6. banyak pengguna yang mengunggah foto-foto berupa ejekan terhadap iphone 6 plus. menariknya, ada seorang pengguna yang menyatakan bahwa iphone 6 melengkung bukanlah sebuah bug atau kesalahan, tetapi merupakan fitur agar pengguna bisa melihat dengan sudut yang lebih baik di iphone. tentu saja, gambar diatas memang bukanlah fitur resmi dari iphone 6, melainkan hanya sindiran untuk masalah desain yang dialami oleh apple. tak kalah menarik, akun twitter resmi perusahaan juga turut memposting gambar yang menarik, memperlihatkan cokelat patah, dan mengatakan kami tidak melengkung, kami . . gambar dari perusahaan yang bekerja sama dengan google ini tentu saja mengundang reaksi beragam dari para pengguna sosial media tersebut yang kebanyakan turut mencibir iphone 6. tak hanya itu, perusahaan-perusahaan lain seperti htc, nokia, dan samsung pun turut memberikan ejekannya dengan hashtag . lagi usah mobile melalui akun twitter juga turut berkicau our phone doesnt bend, itu flexes on purpose. . ponsel kami tidak melengkung, tetapi felxibel. sementara samsung menyindir apple melalui perangkat teranyar galaxy note edge yang memiliki layar curved.",BENAR
