Pesan,Klasifikasi
"demam permainan pokemon go telah mewabah hingga ke penjuru dunia. tak terkecuali di indonesia, permainan ini benar-benar mengalihkan pandangan hampir setiap orang. ada pula yang harus rela menghentikan pekerjaannya demi permainan yang satu itu. permainan pokemon go yang dikembangkan nintendo, pokemon corps dan niantic labs ini telah banyak memakan korban. bahkan ada yang mengalami kecelakaan karena permainan ini. pokemon go belum dirilis resmi di indonesia, namun games ini sangat digandrungi masyarakat dari anak-anak hingga orang dewasa bahkan sampai mengakibatkan kecanduan. seluruh mata gamer tertuju di layar ponsel pintarnya tanpa mempedulikan kondisi sekitar bahkan cendrung membahayakan diri sendiri, tidak sedikit menjadi korban akibat game ini ada kecelakaan terjun ke laut kemudian tenggelam dan ada juga yang jatuh dari ketinggian hingga tewas serta ada juga yang terjebak dalam gua bawah tanah dan tidak sedikit yang tertangkap masuk ke area pemukiman orang lain dan instansi meliter merekapun tertangkap, hal ini semuanya karena untuk memperturutkan ambisi memburu figur monster pokemon yang diinginkan mereka. kata pokemon dalam bahasa inggris merupakan singkatan dari dua kata yaitu kata poke yang merupakan singkatan dari kata pocket, artinya kantong atau saku. dan kata mon yang merupakan singkatan dari kata monster, artinya monster. jadi artinya ialah monster saku. maksudnya merupakan ungkapan betapa kecilnya monster-monster ini hingga dapat terwadahi oleh saku. adapun nama pikachu yang merupakan tokoh termasyhur dalam kartun ini, juga terbentuk dari dua kata pika dalam bahasa jepang menunjukkan makna bersinar. sedangkan kata chu merupakan ungkapan tentang suara-suara yang keluar dari mulut tikus. mengapa dinamakan pikachu? sebab tokoh ini memang bentuknya seperti tikus yang bersenjatakan sengatan listrik. adapun kata-kata charmander menunjukkan makna api yang menyalamembakar. diambil dari kata bahasa inggris char. sedangkan kata amander adalah sebuah kata yang memberikan isyarat pada sebuah binatang semacam kadal yang menyerupai api menyala. keteranggan ini disebutkan oleh atase kebudayaan jepang di yordania kuji taharo, sebagaimana yang ditulis oleh koran yordania ar-rayu pada edisi tanggal 442001. dari keterangan ini, tampaklah kesalahan orang yang menganggap bahwa arti pokemon menurut bahasa suryani adalah saya yahudi, atau makna-makna lain yang senada. bahasa suryani merupakan yang digunakan sebagian warga suriah, walau bukan bahasa resmi namun warga suriah lazim mempergunakan bahasa tersebut untuk berkomunikasi sehari-hari sebagai bahasa kedua setelah bahasa arab. majalah new york times pada edisi tanggal 26 maret 2001 menyebutkan ungkapan juru bicara produsen kartun ini di tokyo yang identitasnya disembunyikan bahwa ia mengingkari kalau perusahaan menggunakan syiar-syiar keagamaan dalam produk-produknya. koran yordania ad-dustur edisi hari senin 8 muharam 1422 h. juga menyebutkan pernyataan beberapa doktor ahli bahasa suryani di universitas yarmuk, begitu pula pernyataan lembaga sosial suryani di yordan, bahwa kalimat pokemon, pikachu dan nama-nama lain dalam kartun pokemon, sama sekali tidak ada kaitannya dengan bahasa suryani, bahkan nama-nama itu asing bagi bahasa suryani. hal serupa juga adanya anggapan bahwa nama-nama tersebut menggunakan bahasa jepang. begitu pula anggapan bahwasanya menggunakan bahasa ibrani. asal-usul pokemon boneka kartun pokemon berasal dari gagasan seorang laki-laki jepang bernama satushi tajiri. ia merupakan orang yang gemar mengumpulkan binatang-binatang serangga. kemudian ia berkhayal bahwa dunia akan diserbu oleh serangga-serangga ini dan oleh binatang-binatang aneh dari angkasa luar dalam jumlah yang sangat banyak dan kemudian ditemukan oleh manusia. terus pada gilirannya binatang-binatang ini berkembang dan meningkat menjadi lebih sempurna dengan keluarnya anggota-anggota tubuh yang baru. kemudian sebuah perusahaan raksasa jepang bernama nintendo mengadopsi gagasan itu dengan memproduksi mainan-mainan elektronik dan mengembangkannya menjadi kartun monster-monster kecil ukuran saku yang menurut gagasan mereka-pen memiliki kekuatan ajaib untuk bertempur. lalu tersebarlah mainan-mainan ini secara signifikan pada akhir tahun sembilan puluhan hingga menguasai seluruh penjuru dunia dalam bentuk mainan elektronik, film-film kartun, film-film hidup, komik-komik, jurnal-jurnal cerita dan bahkan sampai di situs-situs internet. permainan pokemon sudah tersebar dikalangan anak-anak permainan saku, khusus dengan tokoh pokemon. permainan ini berlangsung menggunakan kaidah dan pedoman tertentu, yang dari sana membentuk berbagai macam permainan. di antarnya ada yang rumit karena menggunakan dadu serta alat-alat bergambar dan meja tertentu. permainan ini membutuhkan waktu untuk mempelajarinya. ia berpijak pada prinsip pengumpulan gambar-gambar monster binatang-binatang mengerikan kecil, kemudian melatihnya dalam teknik berkelahi dan berperang. tiap-tiap monster dianggap memiliki kekuatan dan keistimewaan tertentu, dan terbagi menjadi sepuluh golongan. pemenang permainan adalah orang yang tidak hanya mampu mengumpulkan sejumlah banyak gambar monster itu saja-, tetapi juga dapat memanfaatkan dengan baik keistimewaan masingg-masing gambar monster tersebut, dapat melatihnya dengan baik dan mengklasifikasikannya guna dikembangkan dalam pertempurannya melawan musuh. di antara permainannya lagi ada yang mudah, yang tersimpulkan pada penguasaan terhadap kartu khusus yang berisi gambar-gambar monster tertentu dengan kekuatan ajaib tertentu. tujuan permainan ini adalah meraih keuntungan dengan mengumpulkan kartu sebanyak mungkin. sementara itu, kartu-kartu yang berisi monster-monster yang memiliki kemampuan lebih dan berbahaya dibedakan dengan isi gambar-gambarnya yang bernomor khusus, kode dan isyarat, dijual dengan harga lebih mahal. anak-anak kecil beradu dan berlomba mendapatkannya. anak yang menang adalah yang di anggap dapat mengalahkan kartu lawannya. maka ia berhak mendapatkan kartu-kartu lawannya, atau lawan harus menebusnya dengan uang. kemenangan dalam permainan jenis kedua ini terjadi semata-mata karena nasib dan kebetulan, tidak perlu kemahiran apa-apa selain bisa membayar harga kartu. permainan pokemon ini tidak akan ada habis-habisnya kecuali jika allah menghendaki, sebab selalu diciptakan pembaharuan dan pengembangan tokoh-tokoh monster yang baru dan selalu diciptakan lahan-lahan adu permainan yang baru pula, secara besar-besaran. hal-hal yang terlarang secara syariat dalam pokemon 1. syirik dan merusak aqidah muslim hal yang tidak perlu diragukan lagi, bahwa mengada-adakan makhluk hidup khayali yang fiktif apalagi memiliki keistimewaan serta kemampuan luar biasa dan ajaib termasuk gagasan pemikiran paling rusak yang dapat meracuni akal anak-anak. bahkan di sana terdapat propaganda bagi adanya hal-hal luar biasa yang menyamai bahkan mengungguli mujizat para nabi. ini akan membuat seorang anak mempercayai kekuatan ajaib tersebut dan memberikan pembelaan terhadap adanya kekuataan itu. semua ini jelas termasuk perusakan terhadap aqidah anak-anak yang masih fitrah dan lurus. di sana sebagai tambahan lagi, juga terdapat unsur tantangan terhadap kekuasaan al-khaliq kak dan ingin menyaingi ketentuan allah subhanahu wa taala . naudzu billah. ini semua jelas bertentangan dengan aqidah islamiyah yang shahih dan bertentangan dengan manhaj pendidikan yang lurus. 2. bohong terang-terangan kepada anak kecil dan membuat sesuatu yang membahayakannya. itu terjadi melalui penayangan makhluk fiktif yang mempunyai kemampuan ajaib, tetapi yang sesungguhnya tidak ada. ini akan mendorong dan memotivasi anak-anak untuk mempercayai hal-hal semacam. dan itu jelas merupakan kebohongan terang-terangan serta merupakan perusakan terhadap akal dan imajinasi anak-anak. pada dasarnya mainan anak-anak, bahwa anak-anak itu sendirilah yang menentukan mengendalikan mainannya. tetapi hal itu tidak terjadi pada pokemon. bahkan sebaliknyalah yang terjadi. sebab dalam pokemon justru pokemon yang menentukan, mengendalikan dan mengarahkan anak-anak. yang juga mengkhawatirkan dan lebih berbahaya lagi ialah bahwa mainan-mainan, selamanya menunjukkan sesuatu kultur. pokemon juga menawarkan suatu kultur. tetapi ia merupakan kultur budaya khayalan yang menyapu bersih anak-anak di seluruh dunia. ia adalah kultur yang jauh dari fitrah anak-anak bukan muslim, dan jauh dari aqidah serta kultur anak-anak muslim. jadi ia adalah suatu bentuk miniatur budaya, sebab dengan merajalelanya kartun-kartun pokemon ke seluruh dunia, akan menjadikan anak-anak berpikir dengan satu pola fikir yang sama dan akan bermain dengan bentuk mainan yang sama. seakan-akan pokemon tengah menyiapkan anak-anak kemudian membinanya menuju perilaku-perilaku dan nilai-nilai yang sama. ini merupakan suatu bentuk eksperimen mania yang mengabaikan banyak hal lain, sehingga anda lihat kartun-kartun pokemon itu dapat mengikat para orang tua dan mengeluarkan mainan-mainan anak-anak mereka lepas dari pengendalian mereka. pada gilirannya menghapuskan dinding pembatas antara pokemon dengan anak-anak. dan jadilah akhirnya kartun-kartun ini mengendalikan mereka. 3. teori evolusi yang sesat terfahami melalui perkembangan evolutif monster-monster kecil yang memiliki kemampuan ajaib ini dengan sendirinya. ini sejalan dengan teori darwin yang kufur dan batil, yang menyatakan adanya perkembangan dan peningkatan makhluk dengan sendirinya, serta meniadakan keterlibatan al-khaliq dalam perkembangan itu. dan ini adalah kekafiran yang jelas.",BENAR
"berita kabar trending siapa di antara kamu yang tidak main pokemon go? permainan karya nintendo ini berhasil membuat setiap umat manusia menundukkan kepalanya dan memfokuskan mata mereka ke smartphone yang sedang digenggam asyiknya main pokemon go. permainan pokemon go memang menghadirkan pengalaman dan sensasi yang berbeda dibandingkan game yang pernah ada sebelumnya, sehingga tidak heran kalau game ini banyak digandrungi meski umurnya belum mencapai satu bulan. kontroversi terkait pokemon go semakin marak, terlebih di tanah air kita sendiri, indonesia. ya, di negara ini, beragam kontroversi sudah banyak terjadi akibat hadirnya pokemon go di dalam dunia permainan mobile. bukan hanya warga sipil yang berbicara, bahkan sampai wakil presiden indonesia pun turut menyuarakan pendapatnya mengenai pokemon go. selain itu, belum lama ini juga ada berita mengenai pengharaman pokemon go oleh mui indramayu. penasaran? benarkah permainan pokemon go diharamkan? majelis ulama indonesia atau disingkat mui merupakan lembaga swadaya masyarakat yang mewadahi ulama, zuama dan cendikiawan islam untuk membimbing kaum muslim di indonesia. nah, kabarnya mui indramayu kabupaten jawa barat ini telah membuat fatwa bahwa permainan pokemon go ini haram hukumnya. waduh, kenapa bisa begitu ya? kenapa permainan pokemon go diharamkan ya? benar, pihak mui indramayu memang sudah mengharamkan permainan pokemon go. pasalnya, main pokemon go memang dapat membuat kamu terhipnotis. apa maksudnya terhipnotis? ya, kamu bisa secara tidak sadar masuk tanpa izin dan menerobos sejumlah tempat hanya untuk mencari pokemon. maka dari itu, hal inilah yang menjadi acuan mui indramayu untuk mengharamkan pokemon go. menurut wakil ketua mui indramayu, sofyan tsauri menerangkan, jadi permainan itu dikiaskan seperti orang mabuk arak sehingga melupakan pekerjaan dan kewajibannya. selain itu, beliau juga menegaskan bahwa tidak boleh main pokemon go, bahkan permainan itu pun diharamkannya. sebab, sudah banyak dampak negatif yang ditimbulkan, seperti menyia-nyiakan waktu untuk digunakan mencari pokemon, padahal masih banyak hal yang lebih bermanfaat ketimbang memburu pokemon. sofyan memberikan contoh yang nyata, yaitu akibat permainan pokemon go, para pelajar menjadi tidak belajar serta karyawan jadi tidak bekerja bahkan sampai mereka lalai untuk beribadah. tidak hanya itu, beliau juga kembali menegaskan, allah swt mengharamkan arak karena memabukkan layaknya seperti permainan pokemon go, dalam firman allah pada surat al maidah ayat 90 yang berbunyi, hai orang-orang beriman sesungguhnya meminum arak mabuk itu perbuatan setan. berarti, dapat disimpulkan bahwa menurut sofyan, main pokemon go itu merupakan perbuatan setan, karena dampaknya dapat memabukkan. ada yang bilang pokemon artinya aku yahudi, benarkah itu? mendengar kata pokemon, saat ini pasti mindset kamu akan lari ke permainan pokemon go. nah, jika kamu belum tahu, ternyata ada rumor yang mengungkap bahwa arti kata dari pokemon adalah aku yahudi. hal ini diartikan melalui bahasa syriac, atau bahasa suryani yang jika diterjemahkan maka akan memiliki arti seperti itu. wow, hal ini bisa menjadi bukti bahwa pokemon go itu haram ya? sudah banyak kejadian dari pokemon go yang berujung membahayakan nyawa permainan pokemon go memang banyak digandrungi. namun, karena hadirnya pokemon go, banyak orang yang kurang waspada dengan situasi dan kondisi di sekitarnya. apa dampaknya? seperti yang pernah dibahas, penulis dari jalantikus sendiri pernah mengalami kejadian kurang enak akibat main pokemon go, sebab smartphone yang digunakannya pernah mau dijambret. pemerintah siap blokir pokemon go jika terbukti tidak aman beberapa hari sebelumnya, sempat beredar kabar kalau terbukti berbahaya, permainan pokemon go siap diblokir oleh pihak kemenkominfo pasalnya, dilihat dari fatwa mui indramayu dan kejadian yang sudah pernah terjadi, tidak menutup kemungkinan kalau pemerintah benar-benar akan memblokir pokemon go dari indonesia. hal-hal seperti ini semakin mendukung pengharaman permainan pokemon go. jadi, main pokemon go itu perbuatan setan dan haram? sebenarnya,itu tergantung cara kamu memainkan pokemon go. menurut pihak mui indramayu, mereka mengharamkan karena para pemain pokemon go melalaikan tugasnya bahkan sampai lupa beribadah. padahal, jika kamu bisa mengatur waktu, kamu bisa menyelesaikan tugas kamu dulu sebelum main pokemon go, menyelesaikan kewajiban beribadah kamu dulu baru main pokemon go, mungkin tidak akan menjadi sebuah masalah. sehingga, pemerintah pun tidak akan memblokir akses pokemon go dari indonesia. selain itu, pokemon sendiri sebenarnya singkatan dari pocket monsters yang berasal dari bahasa jepang ? poketto monsuta. kemudian, pokemon juga merujuk ke 721 spesies fiksi yang pasti muncul dalam semua seri pokemon. maka dari itu, sepertinya ada kesalahpahaman dalam pengartian dengan bahasa syriac. jika benar pokemon go berarti aku yahudi dan harus ditinggalkan, apakah kamu juga akan meninggalkan media sosial facebook yang notabenenya dibuat oleh kaum yahudi?",SALAH
"mustajab tiba-tiba latah, ikut mengomentari ribut-ribut permainan pokemon go. terus terang saya sedikit kaget, tidak biasanya kawan seperkopian saya ini tertarik ngomongin permainan aplikasi android. setiap kami bertemu, topik pembicaraan selalu serius ngerasani jokowi, ngece-ngece pejabat, kadang mengomong agomo, sesekali diskusi perdukunan, kalau enggak ada bahan ya curhat masalah bojo. sudah download game pokemon? kalau belum, coba lah, buat seru-seru saja, begitu dia membuka percakapan malam itu sambil mengutak-atik gadgetnya, lalu menggeser badan menuang susu jahe--bukan kopi selir seperti biasanya. aku belum tertarik, jab, saya menjawab sekenanya. dia terkekeh dan berkata, kamu harus tahu, gara-gara pokemon ini, katanya sekarang banyak orang rajin ke tempat ibadah. jadi ibadahnya sambil berburu pokemon. itu bagus kan? saya tak begitu tertarik menanggapi provokasi itu. tajab, malah menceritakan tetangganya, mamat, yang tiba-tiba rajin olahraga pagi, pak harjo yang biasanya main gaplek di pos hansip tiba-tiba rajin ke masjid, anwar yang biasanya ogah-ogahan ke sawah tiba-tiba rajin tilik tegalan. pokemon go ini memberi pengaruh positip. orang yang memainkannya menjadi rajin apa saja, ujarnya. jadi intinya begini, mustajab kembali ngoceh, segala sesuatu yang dibuat manusia di bumi itu tidak bebas nilai. termasuk urusan teknologi, game aplikasi dan tetek bengeknya. lagi-lagi dia memprovokasi, sudah lah, daripada tidak ada kerjaan, nganggur, sekarang mending download saja, nanti ayo mencari pokemon bareng-bareng. bermain pokemon melatih insting kita, melatih ketajaman mata kita, melatih otot kaki, badan jadi sehat karena jalan terus, jempol tangan jadi kuat. banyak manfaatnya, katanya melanjutkan. katanya pokemon buatan yahudi, itu gimana? saya asal bicara. kata siapa? jangan menelan informasi mentah-mentah, dicek dulu. sekarang ini antara orang paham dan tidak paham itu beda tipis. hari begini masih percaya informasi tak jelas di media sosial, mustajab menceramahi. dia melanjutkan, khawatir boleh, tapi jangan berlebihan. memang, sekarang lagi ramai di media sosial orang-orang ngeshare tulisan-tulisan yang katanya pokemon itu upaya terselubung orang-orang yahudi. pokemon dikait-kaitkan dengan bahasa syriac atau bahasa suryani bila di-indonesia-kan berarti aku yahudi. emang mereka paham bahasa syriac? itu bahasa kuno lho katanya, lah wong kromo inggil saja tidak paham kok nyinggung bahasa syriac. coba cek di internet, mustajab lalu celingukan mencari-cari smartphone-nya. ini ada banyak artikel tentang bahasa suryani, katanya. dia lalu membacanya dengan suara agak keras. bahasa suryani itu, kata dia, bahasa aram timur yang pernah dituturkan di sebagian besar wilayah bulan sabit subur dan arab timur. tapi secara luas bahasa ini dituturkan oleh bermacam-macam komunitas kristen di timur tengah. bahasa suryani ditulis dengan abjad suryani. bahasa suryani ini sekarang dituturkan oleh kaum minoritas kristen siria yang tinggal di sebelah timur turki, sebelah utara irak dan sebelah timur laut suriah. bahasa suryani juga merupakan bahasa liturgi dari beberapa gereja suriahsiria gereja ortodoks suriah, gereja katolik suriah, gereja maronit, gereja katolik khaldea, gereja timur asiria dan gereja tua timur. konon, penutur bahasa ini tersisa sekitar tiga juta orang. mereka tinggal di suriah, iran, irak, libanon, turki. sebagian lagi menjadi imigran karena genosida dan penganiayaan, dan sekarang ini mereka tinggal di usa, amerika latin, australia dan eropa. tapi itu tidak penting juga sih. semakin dipikir semakin puyeng, katanya sambil mengubah posisi duduknya lagi. ini ada artikel lagi, mustajab menambahkan. koran yordania ad-dustur edisi hari senin 8 muharam 1422 h, mengutip pernyataan beberapa doktor ahli bahasa suryani di universitas yarmuk dan lembaga sosial suryani di yordan. mereka mengatakan, kalimat pokemon, pikachu dan nama-nama lain dalam kartun pokemon, sama sekali tidak ada kaitannya dengan bahasa suryani, bahkan nama-nama itu asing bagi bahasa suryani. pokemon itu akronim dari poket monster. penjelasannya, kata poke itu singkatan dari kata pocket, artinya kantongsaku. dan kata mon merupakan singkatan dari kata monster, artinya monster. jadi artinya monster saku. maksudnya merupakan ungkapan betapa kecilnya monster-monster ini hingga dapat terwadahi oleh saku. mustajab lalu menggeser badannya ke belakang, bersandar pada dinding. coba pikir, kata dia, ketika ada orang memakai produk yahudi, apakah berarti dia otomatis menjadi yahudi. kalau berpikirnya sempit seperti itu, bahaya sekali, kali ini nadanya serius sambil menggeleng-geleng kepala. tapi, dia melanjutkan, kalau alasan kamu tidak bermain pokemon go karena pertimbangan bahaya, membuat orang meleng di jalanan saat berburu pokemon, atau khawatir baterai handphone cepat habis dan panas, khawatir tidak konsentrasi bekerja, takut dimarahi bos karena ada larangan memburu pokemon di kantor, itu lain soal. saya masih pura-pura menyimak. lalu saya berseloroh. jadi kesimpulannya pokemon bukan dibuat orang yahudi ini? sepertinya bukan, ujarnya singkat. berikutnya dia kembali browsing. mustajab lalu membacakan sebuah artikel, pokemon go itu dibuat oleh niantic, perusahaan pengembang perangkat lunak sempalan dari google. perusahaan ini didirikan oleh john hanke tahun 2010 di san francisco, california, amerika serikat. tahun kemarin niantic lepas dari google. niantic kemudian bekerja sama dengan pokemon company, pemilik lisensi pokemon tadi. sepertiga saham pokemon company ini miliki nintendo, perusahaan video game yang didirikan oleh fusajiro yamauchi di tokyo, jepang, pada 23 september 1889. mendadak mustajab berhenti membaca dan terlihat berpikir. lalu dia menatap saya. jadi yang membuat pokemon itu orang jepang, masak orang jepang ada yang yahudi sih? katanya singkat. dia meneruskan membaca, pokemon company selama ini mengembangkan bisnis waralaba franchise. pokemon berakar dari komik, film anime, video game, kartu, tazos, dan merchandise lainnya. sejak tahun go-an sampai sekarang, sudah ada enam generasi pokemon. jumlah total spesies pokemon dari keenam generasi itu sudah mencapai 721 spesies. banyak juga ternyata spesies monter pokemonnya. saya segera menyela. omong-omong kamu sudah dapat pokemon berapa? mustajab cuma menyengir seperti memamerkan gigi tongosnya. saya menduga, dia tidak punya waktu memburu pokemon. dia memang penggila game aplikasi, tapi sudah beberpa minggu ini berhenti gara-gara dimarahi istri.",BENAR
"ada banyak reaksi orang terhadap game yang sangat ini populer, pokemon go. para ulama di mesir dan arab menyatakan game ini haram dan tidak islami karena membuat para pemain berperilaku seperti orang mabuk dan tergila-gila untuk berburu pocket monster monster saku. sekarang di berbagai sosial media di indonesia, orang-orang menyebarkan informasi menyatakan jika pokemon go mempromosikan zionisme dan merupakan game yang menghina agama islam. dikatakan jika pokemon sebenarnya dalam bahasa syriac atau bahasa suryani mempunyai arti aku yahudi, sementara pikachu disebutkan berarti jadilah yahudi, dan charmander bermakna tuhan itu lemah. rupanya tuduhan ini sudah muncul sejak lama. pada 2001 saat video game pokemon populer, beredar isu jika game itu merupakan konspirasi yahudi untuk menyebarkan paham zionisme. dalam artikel yang dimuat di situs berita lah times, pada tahun itu beredar berbagai brosur di timur tengah yang menyatakan jika pokemon adalah perusahaan yahudi dan nama-nama monster di dalamnya menghina agama islam. brosur itu lebih jauh menyatakan jika pokemon sebenarnya berarti saya yahudi. brosur itu, ditulis dalam bahasa arab yang buruk, menyatakan jika pikachu, karakter paling populer dan kuat berarti saya yahudi dalam bahasa jepang, kata abdel rahman mtowah, editor surat kabar di arab saudi, al sharq al awsat. tuduhan jika pokemon dan pikachu berasal dari bahasa syriac atau suryani, dialek bahasa aram yang ada di bagian aram sendiri sudah dibantah pada 2001 saat rumor itu beredar. gereja kristen ortodoks syriac yang ada di yordania menyatakan jika pokemon dan pikachu bukan berasal dari bahasa suryani. bantahan serupa dirilis oleh gereja kristen ortodoks di yerusalem. sementara atase budaya jepang di yordania pada 2001 menyatakan jika ada banyak orang meminta dirinya untuk memberitahu mereka kata jepang untuk yahudi. yahudi dalam bahasa jepang adalah youdayajin, jauh berbeda dengan kata pokemon. pokemon sendiri merupakan singkatan dari pocket monsters. di jepang kami menggunakan kata poke yang berarti sesuatu yang kecil. pokekom berarti pocket computer, ujar tahara kepada afp. saya tidak tahu bahasa ibrani tapi sejauh yang saya tahu tidak ada bahasa asing atau tersembunyi di pokemon, kata tahara. pokemon sendiri diciptakan oleh satoshi tajiri, ken sugimori dan dikelola oleh the pokemon company, gabungan dari nintendo, game freak dan creatures. nama pokemon sendiri merupakan singkatan dari pocket monsters atau monster saku. dalam bahasa jepang disebut poketto monsuta. sementara pikachu sendiri merupakan kombinasi dari dua suara dalam bahasa jepang. pika yang merupakan suara percikan listrik dan chu adalah suara yang dikeluarkan tikus.",BENAR
