Pesan,Klasifikasi
"tidak diberhentikannya ahok sebagai gubernur dki jakarta terkait stastusnya sebagai terdakwa dalam kasus penistaan agama islam, menunjukkan bahwa betapa susahnya hukum di negeri ini untuk ditegakkan. bagaimana bisa mencari keadilan kalau hukum yang menjadi alat untuk mencari keadilan saja sulit untuk ditegakkan. tidak sedikit pakar hukum dan tata negara termasuk mantan hakim maka mahfud md, mengkritisi langkah yang diambil pemerintah, khususnya mendagri tjahyo kumolo dan presiden joko widodo yang diam saat ahok kembali menduduki kursi gubernur, semetara beberapa kepala daerah lain justru diberhentikan saat statusnya menjadi terdakwa suatu tindak pidana. hal ini akhirnya bermuara pada tuntutan penegakan hukum lewat aksi bela islam dan bela negaran yang dilakukan oleh masyarakat muslim yang tergabubg dalam fui forum umat islam pada hari ini selasa, 21022017. selain massa dari fui, terlihat juga sejumlah mahasiswa yang tergabung dalam gerakan mahasiswa bela rakyat. adapun tuntutan mereka diantaranya adalah, memberhentikan gubernur yang menjadi tersangka, hentikan kriminalisasi ulama, hentikan penangkapan aktivis mahasiswa, kembalikan kedaulatan bangsa dan kembalikan ke uud 1945 yang asli. aksi yang digelar di depan gedung dpr-mpr ini ternyata ikut menarik massa dari luar jakarta. mereka coba untuk berkumpul di masjid istiqlal untuk melakukan shalat shubuh berjamaah dan juga saat itu cuaca sedang hujan.rupanya pagar masjid istiqlal justru tertutup rapat, padahal saat itu sudah mendekati waktu shubuh. akibatnya jamaah aksi harus kehujanan, sebagian diantaranya memilih tiduran di jalan sambil menunggu waktu shubuh. menurut laporan salah satu kontributor gabbarberita.com di lapangan, masjid baru dibuka pukul sekitar pukul 04.00 wib. sebelumnya kemana pengurus bppmi dan ditunjuk dan dilantik langsung oleh menteri agama yang juga dalam struktur selaku ketua bppmi.",SALAH
"peserta aksi 212 jilid 2 yang berasal dari luar kota telah berdatangan di masjid istiqlal, namun mereka tidak bisa masuk karena pintu pagar masjid dikunci. menurut pantauan, ratusan massa mengendarai 5 bis yang diantaranya berplat nomor ada solo dan sekitarnya tertahan di pintu masuk masjid istiqlal, senin 202 malam, akibat masjid yang biasanya menjadi tempat berkumpul aksi bela islam sebelumnya itu ditutup. baca pintu istiqlal ditutup, 5 bus peserta aksi 212 tak bisa masuk aparat kepolisian yang berjaga di depan masjid istiqlal kemudian mengarahkan bus dari daerah itu ke tempat lain. tidak dijelaskan kemana tempat berkumpul massa tersebut dialihkan. untuk kasus yang semalam, memang ada peserta aksi yang datang dari jawa timur sebanyak lima bus. mereka mengaku datang dari madura. peserta masuk masjid setelah waktu isya. pihak masjid memberikan kesempatan untuk beribadah dan bersih-bersih. rombongan dari jawa timur paham dan mengerti. pihak pengelola masjid menunggu mereka sampai meninggalkan masjid istiqlal dengan sukarela. kemudian pada pukul 03.40 wib masjid dibuka kembali. sebelumnya, forum umat islam fui memastikan tidak ada long march saat aksi 212 jilid ii, selasa 212 besok. peserta aksi akan diarahkan langsung menuju ke titik konsentrasi aksi di depan gedung dprmpr ri. skenario kita tidak ada long march. jadi peserta diimbau semuanya langsung menuju ke gedung dprmpr ri, kata ustaz bernard abdul jabbar selaku koordinator aksi 212 jilid ii kepada wartawan di mapolda metro jaya, jakarta, senin 2022017. ustadz bernard memperkirakan jumlah peserta aksi yang akan hadir 10 ribu orang. massa dari luar jakarta diminta memarkir kendaraannya di kantong-kantong parkir yang telah disiapkan. dan bagi mereka yang dari daerah-daerah yang bawa bus dan kendaraan, kami kemudian arahkan untuk parkir di parkir timur senayan kalau yang dari arah selatan dan timur. sementara dari arah barat ini akan kami arahkan untuk memarkir kendaraan di stasiun palmerah dan di depan gedung departemen kehutanan, jelasnya. ia menambahkan, pihaknya juga tidak memberikan fasilitas tempat penginapan bagi peserta aksi dari luar daerah. artinya mereka yang dari luar kota jakarta dipersilakan mencari tempat istirahat sendiri.",SALAH
"kepala bagian protokol dan humas masjid istiqlal jakarta, abu hurairah abd salam menanggapi kabar massa 212 jilid ii yang tidak boleh masuk ke masjid. ia menegaskan bahwa foto-foto yang beredar di media sosial, selasa 21217 pagi adalah hoax atau bohong. kabar bahwa ada massa aksi 212 tak bisa masuk istiqlal itu hoax seribu persen, terang abu, selasa 21217. ia menjelaskan pada senin malam selepas isya ada tiga bus rombongan yang masuk ke masjid istiqlal. mereka mengaku rombongan dari pulau madura. pengurus masjid mempersilakan mereka untuk beribadah dan bersih-bersih diri. selanjutnya, pengurus masjid berkoordinasi dengan pimpinan rombongan yang didampingi oleh polisi. usai berbincang, mereka kemudian secara suka rela meninggalkan masjid istiqlal. abu kembali menerangkan bahwa sesuai dengan prosedur, masjid istiqlal di luar bulan ramadhan ditutup pukul 21.30 wib dan dibuka kembali satu jam sebelum salat subuh. sementara, tentang foto antrean jemaah di gerbang masjid adalah rombongan peziarah dari luar kota. abu mengatakan mereka ingin masuk ke masjid tetapi pintu baru dibuka pada pukul 03.45 wib. pada pagi hari sebelum subuh, selasa tanggal 21 februari 2017, ada beberapa peziarah dari luar kota yang akan masuk ke masjid istiqlal dan mereka datang sebelum pintu masjid istiqlal dibuka pukul 03.45 wib. kami sampaikan permohonan maaf atas hal tersebut, kata abu.",BENAR
"badan pengelola masjid istiqlal bppmi membantah kabar yang beredar di media sosial tentang masjid istiqlal menutup pintu untuk jemaah yang akan menginap pada senin malam, 20 februari 2017, dan tidak mengizinkan melakukan salat subuh di istiqlal. menurut pengelola, hal itu tidak benar. sejak 2002, masjid istiqlal telah memberlakukan aturan menutup pintu gerbang setiap pukul 21.30 wib dan membukanya kembali pukul 03.40 wib menjelang ibadah salat subuh, ucap sekretaris bppmi rusli efendi di masjid istiqlal, jakarta, selasa, 21 februari 2017. dia mengatakan semua peziarah tidak diperkenankan menginap di area masjid, kecuali dalam kondisi tertentu serta atas izin pihak keamanan dan pimpinan bppmi. dia telah menjelaskan kepada jemaah yang berkumpul di halaman masjid istiqlal tentang aturan tersebut, dan mereka memahami serta bersedia meninggalkan area masjid. lagi pula, bppmi tidak mendapatkan pemberitahuan dari pihak mana pun terkait dengan rencana jemaah menginap, seperti pada kondisi sebelumnya saat umat islam mengadakan aksi 411, 212, atau 112. selain itu, tidak ada komunikasi khusus dari pihak berwajib terkait dengan hal tersebut, ucap rusli. bppmi menyatakan berita-berita negatif tentang masjid istiqlal yang digembok dan membiarkan massa forum umat islam fui di luar tidak sesuai dengan kenyataan dan cenderung bermuatan provokasi. kepada segenap kaum muslimin dimohon tidak terpengaruh pemberitaan yang tidak dapat dipertanggungjawabkan, ujar rusli. dia menuturkan, pada subuh tadi, pelaksanaan salat subuh berjalan dengan baik dengan dipimpin imam salim ghazali dan diikuti 170 anggota jemaah laki-laki dan 70 perempuan. masjid istiqlal menyerukan kepada umat untuk mengupayakan kesatuan dan persatuan bangsa serta senantiasa menjaga kenyamanan beribadah.",BENAR
"dream - sejak pagi tadi, di media sosial beredar kabar yang menyebut masjid istiqlal digembok, sehingga sebagian jemaah peserta aksi 212 jilid ii tidak bisa melaksanakan sholat subuh. namun, humas badan pelaksana pengelola masjid istiqlal bppmi, abu hurairah, membantah kabar yang beredar itu. dia menyatakan, kabar tersebut bohong alias hoax. bppmi menyatakan bahwa berita-berita negatif yang telah tersebar di media sosial mengenai hal tersebut masjid istiqlal digembok, tidak sesuai dengan kenyataan dan cenderung bermuatan provokasi, kata abu hurairah di masjid istiqlal, jakarta pusat, selasa 21 februari 2017. abu mengatakan, sholat subuh berjamaah tetap digelar di masjid istiqlal pagi tadi. dia mencatat, terdapat sekitar 240 orang yang menjalankan sholat subuh berjamaah. laki-laki 170 dan wanita 70 orang, kata dia. terkait penutupan masjid, abu menjelaskan bahwa peraturan tersebut telah dijalankan sejak 2002. di luar ramadan, masjid istiqlal akan ditutup selepas sholat isya hingga subuh. sejak 2002, bppmi telah memberlakukan aturan untuk menutup pintu-pintu gerbang pada setiap malam pukul 21.30 wib dan membukanya kembali pada pagi hari pukul 03.40 wib menjelang diselenggarakannya ibadah sholat subuh, ucap dia. abu menambahkan, memang ada sejumlah jemaah yang datang dan menginap di masjid istiqlal. mereka tiba dari jawa timur menggunakan lima bus. tetapi, kata dia, bppmi menyatakan tidak menerima pemberitahuan terkait rencana menginap tersebut. sehingga, izin menginap tidak diberikan kepada rombongan itu, kemarin malam. abu mengakui, masjid istiqlal memang membolehkan jemaah aksi 411, 212 jilid i dan 112 menginap. tetapi, koordinator aksi diminta memberikan informasi secara tertulis lebih dulu sebelumnya. pihak keamanan masjid istiqlal sudah menjelaskan kepada jemaah yang berkumpul di halaman masjid istiqlal mengenai prosedur tersebut dan mereka memahami serta bersedia meninggalkan area masjid istiqlal, ucap dia. abu meminta umat islam tidak terpengaruh berita yang isinya meragukan dan tidak dapat dipertanggungjawabkan itu. kabar yang beredar itu berupa foto yang menampilkan massa berkopiah. mereka tengah berada di depan gerbang masjid istiqlal pada malam hari. kabar itu menyebut para jemaah tidak diperbolehkan menjalankan sholat subuh di masjid istiqlal. kabar tersebut viral di media sosial twitter dengan tagar istiqlal digembok. sejumlah foto menunjukkan sejumlah orang menjalankan sholat berjamaah di tepi jalanan.",BENAR
"kepala bagian protokol masjid istiqlal, abu hurairah menyatakan, kabar mengenai digemboknya masjid sehingga umat tidak bisa shalat subuh adalah hoax atau bohong. menurutnya, penutupan masjid memang sudah peraturan atau pun protap di istiqlal. berita itu hoax seribu persen, tolong berita itu dicek siapa yang tulis, kata hurairah, saat dihubungi, selasa 212. hurairah menjelaskan, di luar bulan ramadhan, istiqlal ditutup usai shalat isya, sekitar pukul 21.30 wib, dan sudah berdasarkan uu. kemudian dibuka kembali satu jam sebelum shalat subuh. peristiwa semalam itu yang datang hanya lima bus dari jawa timur. mereka masuk selepas isya, kemudian diberikan kesempatan beribadah, bersih-bersih, bicara baik-baik dengan ketuanya, kami berikan pengertian, dan alhamdulillah paham dan meninggalkan istiqlal secara sukarela, katanya. selain itu, kata dia, rombongan tersebut tidak tahu bahwa aksi hari ini akan sebesar 2 desember lalu maupun 411. sementara, rombongan yang tadi pagi mengantre di masjid karena hujan, adalah rombongan walisongo, yang memang setiap hari datang.",BENAR
"badan pelaksana pengelola masjid istiqlal bppmi meluruskan informasi yang beredar di media sosial terkait penutupan gerbang ?bagi pengunjung pada malam sebelum aksi 212. menurut sekretaris bppmi kah rusli effendi, pihaknya sejak 2002 telah memberlakukan aturan menutup semua pintu gerbang setiap malam pukul 21.30 wib dan membukanya kembali pukul 03.40 wib jelang ibadah salat subuh. seluruh peziarah tidak diperkenankan menginap di area masjid kecuali dalam kondisi tertentu dan atas izin dari pihak keamanan serta pimpinan bppmi, kata rusli di jakarta, selasa 212. terkait kondisi malam hari tanggal 20 sampai dini hari 21 februari, pihak keamanan masjid istiqlal sudah menjelaskan kepada jemaah peserta aksi 212 yang berkumpul di halaman mesjid mengenai prosedur tersebut. mereka memahami serta bersedia meninggalkan area masjid, ucapnya. menurut rusli, bppmi tidak mendapat pemberitahuan dari pihak mana pun terkait rencana jemaah yang akan menginap seperti pada kondisi sebelumnya saat umat islam mengadakan aksi 411, 212 atau 112. juga tidak ada komunikasi khusus dari pihak berwajib terkait hal tersebut. masjid istiqlal senantia berkhidmad kepada umat dan mengupayakan kesatuan serta persatuan bangsa dan selalu menjaga kenyamanan beribadah. kami mengimbau seluruh kaum muslimin tidak terpengaruh oleh pemberitaan yang tidak bisa dipertanggungjawabkan, pungkasnyamenjelang aksi 212 jilid ii di depan gedung dpr-mpr pada 21 februari 2017 lalu, ada gambar menyebar di dunia maya, khususnya di media sosial, yang mengabarkan kalau masjid istiqlal ditutup pakai gembok dan diberi kawat berduri, sehingga massa yang akan ikut aksi tak bisa masuk dan tidur di jalanan. tudingan itu langsung dibantah oleh kepala bagian protokoler masjid istiqlal abu hurairah, dan dinyatakan sebagai hoax. sebab, menurut hurairah, pihaknya tidak pernah melarang aksi dan tidak pernah mengunci pintu masjid. hoax seribu persen, tegas abu saat dihubungi wartawan pada selasa 212. kemudian setelah beredarnya gambar hoax itu, lalu beredar lagi dua gambar polisi sniper memegang senjata, di mana yang satu tengah berada di sebuah halte mengintai jalan raya dan satu lagi berada di satu ruangan tengah mengintai gedung dpr. tidak hanya itu saja, dua gambar editan itu gambar polisi sniper telah bermetamorfosa menjadi gambar meme. dua gambar tadi dipadukan dengan gambar hoax digemboknya masjid istiqlal untuk massa aksi 212 jilid ii. gambar itu diedit dan disusun secara vertikal atas-bawah. pada gambar bagian atas, diberi keterangan pintu masjid istiqlal digembok dan diberi kawat berduri. sementara pada gambar bagian bawah, diberi keterangan di gedung dpr disiapkan sniper. ya allah apakah kami sudah dianggap musuh di negeri kami sendiri. pertanyaannya, apakah keterangan di dalam gambar bagian bawah itu benar adanya? kalau memperhatikan isu digemboknya masjid istiqlal yang telah dinyatakan sebagai hoax, maka bukan tidak mungkin gambar polisi sniper tadi juga hoax. apalagi dari foto yang beredar, tidak ada bukti nyata yang menunjukkan kalau polisi sniper itu tengah megintai massa aksi. kasus ini serupa dengan isu yang sempat beredar beberapa saat menjelang digelarnya aksi 411 pada akhir 2016 lalu. saat itu, pihak kepolisian juga dituding hal yang sama akan menyiapkan para sniper untuk mengamankan aksi. menanggapi hal itu, kabid humas polda metro jaya kombes pol awi setiyono menegaskan, pihaknya tidak akan mengerahkan sniper atau penembak jitu pada saat aksi 411 terkait dugaan penistaan agama yang dilakukan basuki tjahaja purnama alias ahok. nggak ada, tidak ada itu, tegas awi di mapolda metro jaya, kamis tanggal 3 november 2016.",BENAR
"beberapa saat lalu heboh sikat gigi yeng terbuat dari bulu babi, dengan pemberitahuan seperti ini, ayo cek sikat giginya, bila ada tulisan bristle pada kemasan, maka berarti sikat gigi tersebut mengandung bulu babi. ada kata bristle pada gagang kuas. dalam kamus webster, kata itu berarti bulu babi. bristle berarti pig hair alias bulu babi! jadi periksa kembali kemasan sikat gigi anda saat membeli. demikian juga pada kuas pengoles roti, biasanya tertulis bristle, pure bristle, 100 china bristle. sedikit tambahan tentang bagaimana menentukan apakah kuas yang anda gunakan menggunakan bahan tersebut atau tidak. untuk menentukan apakah kuas yang anda gunakan berasal dari bulu rambut babi, bisa menempuh langkah yang sangat mudah dan sederhana. rambut atau bulu adalah suatu protein yang bernama keratin. keratin merupakan salah satu kelompok protein yang dikenal sebagai protein serat. protein serat memiliki struktur panjang. setiap hewan memiliki protein keratin pada bagian dermis permukaan dari kulit, kuku, paruh, sisi ikan, tanduk, dan kuku binatang. sebagai halnya protein, maka rambutbulu yang mengandung keratin saat dibakar akan menimbulkan bau yang khas. bau khas tersebut sama ketika kita mencium aroma daging yang dipanggang. sementara bila kuas itu terbuat dari ijuk atau sabut ketika dibakar pasti akan langsung terbakar, dan tidak mengeluarkan aroma spesifik selain bau abu pembakaran. ketika dibandingkan dengan sapu ijuk dibakar jelas sekali terdapat perbedaan bau yang sangat kentara. selain ciri-ciri tadi, kuas yang terbuat dari bulurambut babi masih memiliki perbedaan pada warna. kuas yang terbuat dari bulurambut babi biasanya berwarna putih. biasanya kuas yang berwarna putih nan lembut itu harganya lebih tinggi dibanding barang serupa. kuas berwarna putih itu di pasaran biasa disebut kuas bristle. tapi tunggu dulu, setelah melakukan penelitian kecil-kecilan, ternyata oh ternyata, makna dari kode tersebut bukan lah bulu babi. berikut penjelasannya bantu meluruskan kembali, setelah hoax kode e sebagai produk dengan babi semua, ini penjelasan hoax kalau bristles juga babi semua, semoga bisa mengurangi keresahan masyarakat bristle akhirnya lewat juga thread bristle di news feed sayang begini ya ibu-ibu bristle adalah kata yang masih bersifat umum. kalo dalam bahasa arab, isim nakirah. arti kata bristle adalah helaian yang halustipis filamen dan kokohkuat. tulisan bristle yang ada pada sikat gigi, se-mata2 berarti bulu, bukan bulu babi. kata bristle yang sifatnya umum isim nakirah itu baru bermakna lebih khusus ketika disandingkan dengan kata lain, misal pure bristle atau 100 bristle atau natural bristle artinya bulu berbahan murni bulu hewan atau serat tumbuhan tetap masih belum tentu dari bulu babi. bisa dari kuda atau hewan2 lainnya. bristle dari serat tumbuhan pun ada, yaitu kayu siwak. bulu atau bristle pada sikat gigi jaman dinasti tang 619 - 907 memang terbuat dari bulu babi, tetapi sikat gigi modern yang dibuat sejak tahun 1938 dibuat dari nylon. hingga saat ini masih ada sekitar 10 sikat gigi dari bulu babi beredar di seluruh dunia jadi bukan 10 di indonesia seperti yang dituliskan jeng yang statusnya saya foto. untuk alasan higiene, produsen dan konsumen sikat gigi modern sendiri lebih memilih sikat gigi berbahan nylon. tampaknya keriaan menyambut informasi bristle sikat gigi terjadi akibat kekeliruan pemahaman ketika membaca artikel di situs milik lppok mui. artikel yang membahas bulu kuas untuk masak-memasak, dianggap sama dengan bulu pada sikat gigi. bagian yang disalahpahami yang ini pada gagang kuas berbulu babi sering tertulis kata bristle, pure bristle, 100 china bristle, dll. salah satu makna kata bristle adalah pig hair atau bulu babi websters dictionary yang berstatus najis apabila basah. oleh karena itu, roti yang terkena sapuan kuas najis menjadi terkena najis, sehingga haram dimakan. pengganti kuas bulu babi adalah kuas dari bahan plastik polyester. perusahaan kuas merk ken master dan selery juga meproduksi kuas dari bahan halal ini. kata salah satu dalam artikel itu tidak dipahami sebagaimana mestinya dimana salah satu juga berarti tidak semua makna kata bristle adalah bulu babi, termasuk bulu sikat gigi modern yang bristlenya nylon. dan sebagian orang tidak mau repot-repot memeriksa ulang apakah benar kata bristle hanya berarti berarti bulu babi. qadar allah kekeliruan ini begitu masif sampai-sampai salah satu situs milik salah satu asatidz pun memaknainya secara keliru.",BENAR
"akhir-akhir ini dunia maya diributkan dengan kuas atau sikatsikat gigi yang terbuat dari bristle karena dianggap pasti dari babi. walaupun kita dituntut waspada, namun tidak semua istilah bristle selalu mengacu kepada bulu babi. makna bristle secara leksikal adalah a short, stiff hair, fiber, etc websters dictionary. jadi semua rambut, serat yang kaku, maka secara istilah akan disebut sebagai bristle. rambut, jenggot yang kaku, bisa dikategorikan sebagai bristle. contoh yang lain adalah ijuk atau daun pinus yang kaku pun bisa disebut sebagai bristle. lantas, bagaimana aplikasinya di dalam dunia industri? dalam dunia industri bristle memang digunakan sebagai bahan pembuat kuas atau sikat brush termasuk sikat gigi toothbrush. bristle dimaksud bisa bersumber dari bulu hewan atau serat tanaman atau serat sintetik seperti nylon dan silikon. bulu hewan yang digunakan bisa bersumber dari babi, kambing, kuda, atau unta. serat tanaman yang pernah juga digunakan sebagai bahan kuas atau sikat adalah ijuk. nylon pun serat sintetik yang jamak digunakan untuk bahan kuas, sikat atau pun sikat gigi. dari aspek kehalalan bahan kuas dan sikat termasuk sikat gigi yang berasal dari bulu hewan adalah titik kritis. ketika bahannya adalah bulu babi maka tidak boleh digunakan karena bahan apapun yang berasal dari babi adalah haram sekaligus najis, baik dalam bentuk kering ataupun basah. ditambah lagi selain keharaman zatnya, mui sudah memfatwakan apapun yang berasal dari babi haram untuk pemanfaatannya al-intifa termasuk bulunya. namun masalahnya tidak semua pengguna kuas atau sikat atau sikat gigi mampu mengenali apakah kuas yang digunakannya adalah kuas atau sikat yang berasal dari bulu babi. salah satu informasi yang bisa dilihat sebagai penanda bahwa sikat atau kuas berasal dari bulu babi adalah dituliskannya sebagai nama produk misalnya boar bristle brush. boar adalah istilah bahasa inggris untuk babi hutan atau celeng. artinya produk tersebut merupakan sikat yang menggunakan bulu babi hutan. sikat gigi pun juga bisa menggunakan bulu celeng ini. amazon.com, toko online global juga menawarkan sikat gigi babi dengan nama fuchs toothbrushes pure natural boar bristle record v adult soft pack of s-assorted colors by fuchs toothbrushes coba lihat url link ini dan sikat yang terbuat dari bulu babi trusted wooden boar hair bristle beard brush by leven rose - perfect for a beard grooming kit for men - made of boars hair bristles and firm natural wood. coba dicek di url link ini namun, kuas, sikat, atau sikat gigi tidak selalu terbuat dari babi walaupun ada tulisan bristle nya, karena istilah bristle yang masih bersifat umum. ada beberapa produsen sudah menggunakan bulu kambing atau bulu unta atau kuda sebagai bahan kuas atau berbahan nylon. kelompok bahan terakhir jelas boleh digunakan. ketika tidak ada informasi sumber bahannya, paling tidak dapat dipakai cara sederhana. untuk memastikan apakah berbahan bulu hewan atau tidak, cara yang dimaksud adalah dengan membakar bahan tersebut. jika baunya seperti rambut atau tanduk terbakar, lebih baik tinggalkan saja. bahan dari plastik atau sabut kelapa tidak mengeluarkan bau khas seperti itu jika dibakar.",BENAR
"jakarta, beredar kabar di dunia maya bahwa ada produk sikat gigi yang menggunakan bahan bulu babi. disebutkan agar konsumen muslim berhati-hati terhadap sikat yang pada kemasannya ada tulisan bristle karena itu berarti bulu babi. benarkah kabar tersebut? lembaga pengkajian pangan obat-obatan dan kosmetika majelis ulama indonesia lppom mui dalam situs resminya berusaha menjelaskan bahwa bristle bukan selalu berarti bulu babi. makna kata bristle secara umum dapat berarti semua rambut atau serat yang kaku. rambut, jenggot yang kaku, bisa dikategorikan sebagai bristle. contoh yang lain adalah ijuk atau daun pinus yang kaku pun bisa disebut sebagai bristle, tulis lppom mui dikutip pada selasa 1112016. salah satu informasi yang bisa dilihat sebagai penanda bahwa sikat atau kuas berasal dari bulu babi adalah dituliskannya sebagai nama produk misalnya boar bristle brush. boar adalah istilah bahasa inggris untuk babi hutan atau celeng. artinya produk tersebut merupakan sikat yang menggunakan bulu babi hutan, lanjut lppom mui. drg eva fauziah dari ikatan dokter gigi anak indonesia idgai berkomentar bahwa pada sikat gigi di pasaran umumnya, bulu yang digunakan berbahan nylon. nylon seperti diketahui adalah serat sintetik terbuat dari bahan plastik. bulu sikat gigi biasanya itu dari nylon, tegas drg eva ketika ditemui detikhealth. bila memang seseorang curiga terhadap suatu produk sikat gigi, ada cara yang dapat dilakukan untuk memastikan apakah sikat terbuat dari bulu hewan atau bahan lain. cukup bakar ujung sikat dan cium apakah baunya seperti rambut atau tanduk terbakar. jika baunya seperti rambut atau tanduk terbakar, lebih baik tinggalkan saja. bahan dari plastik atau sabut kelapa tidak mengeluarkan bau khas seperti itu jika dibakar, tutup lppom mui. dalam broadcast yang beredar melalui grup whatsapp maupun media sosial, disertakan gambar bagian belakang kemasan produk sikat gigi. namun sepertinya produk itu tidak dipasarkan untuk pasaran indonesia. sih penyebar broadcast melingkari kata bristles yang ada dalam kemasan sikat gigi tersebut sembari menjelaskan tentang maknanya.",BENAR
